"open,Hackerspaces.org",Academic,North America,Fab Lab Baltimore,United States,"Building H Room 145 800 S Rolling Rd,  21228, ",Baltimore,,"Fab Lab Baltimore is a digital fabrication lab and community workspace that serves as a resource for students, designers, artists, entrepreneurs, and other professionals in the Mid-Atlantic region. Membership



To use the Fab Lab you must first take a brief Fab Lab Introduction class to learn basic safety and operating procedures.  This intro class makes you a lab member, and gives you access to the computer workstations, basic hand tools, and our Workshop Wednesday series. 





In order to use the laser cutters, vinyl cutter, CNC router, or 3D printers, you must take the course specific to those machines.



View the courses here: fablabbaltimore.org",Fab Lab,fablab,wwerneke@ccbcmd.edu,http://www.fablabbaltimore.org,,https://www.facebook.com/FabLabBaltimore,39.2531,-76.7353,,,,,,,,,,,,,2001,,,https://twitter.com/FabLabBaltimore,,,,,,,,,,,,,,,,,,,,Bill,Werneke,Management,http://movement.open.co/sites/default/files/styles/medium/public/fab-lab-baltimore.jpeg?itok=4flAhvwB,"Making, Learning","Community, Tech",Physical,Local,,,,,The Community College of Baltimore County,800 South Rolling Rd,Maryland,Baltimore,21202,"The Community College of Baltimore County, 800 South Rolling Rd, Maryland, Baltimore, 21202","Part of the Fab Lab network, a global collection of small-scale workshops containing the tools for personal digital fabrication.",Makerspace,39.2903848,-76.6121893,,,,,,,,
42387.63552,Hosted by a University,Europe,Fab Lab Barcelona,Spain,"C/Pujades 102 baixos. Poble Nou, Barcelona 08005 Espa_a - See more at: http://fablabbcn.org/contact.html#sthash.0G490Nmk.dpuf",Barcelona,Spain,"It is also the headquarters of the global coordination of the Fab Academy program in collaboration with the Fab Foundation and the MITÍs Center for Bits and Atoms; the Fab Academy is a distributed platform of education and research in which each Fab Labs operates as a classroom and the planet as the campus of the largest University in construction in the world, where students learn about the principles, applications and implications of digital manufacturing technology. - See more at: http://fablabbcn.org/about_us.html#sthash.2VCisWjp.dpuf",Fab Lab,Part of the official Fab Lab network,info@fablabbcn.org,http://fablabbcn.org/,,,41.385064,2.173403,"3D Printing, CNC Milling, Metal Fabrication, Woodworking, Laser Cutting/Engraving, Vinyl Plotter, Electronics Lab",,,,,,,,,,,,,,,,,,,,,,,,,,,,,,,,,,,,,,,,,,,,,,,,,,,,,,,,,,,,,,,,
"open,fab_lab",Entrepreneur,Europe,Fab Lab BCN,Spain,"Carrer de Pujades, 102,  8005, ",Barcelona,,"Fab Lab Barcelona is a centre of production, investigation and education, that uses the latest computer-assisted design software for the creation of prototypes and scale models. Fab Lab Barcelona is a centre of production, investigation and education, that uses the latest computer-assisted design software for the creation of prototypes and scale models for Architecture, Construction and Industrial Design.",Fab Lab,fab lab,info@fablabbcn.org,http://fablabbcn.org,,https://www.facebook.com/FabLab.BCN,41.3965511,2.1941618,,,,,,,,,,,,,2007,,,http://twitter.com/fablabbcn,,,,,,,,,,,,,,,,,,,,Tomas,Diez Ladera,Director,http://movement.open.co/sites/default/files/styles/medium/public/fab-lab-bcn.jpeg?itok=wdd8v3qY,"Making, Learning","Community, Tech",Physical,Local,,,,,"Carrer de Pujades, 102",,Catalonia,Barcelona,8005,"Carrer de Pujades, 102,  Catalonia, Barcelona, 8005","Part of the Fab Lab network, a global collection of small-scale workshops containing the tools for personal digital fabrication.",Makerspace,41.3964999,2.194180289,,,,,,,,
fab_lab,,Arab World,Fab Lab Beirut,Lebanon,"Bliss, Al Makhoul street, Al Makhoul building, Ground floor, Beirut, Lebanon","Beirut, lebanon",,"Located in the heart of the city, FabLab Beirut is a maker space where an idea will turn into a reality! Digital architecture, prototyping, 3D printing, milling processes, laser cutting and much more! Serving as social and educational ground for the young and adults, FabLab Beirut offers workshops in digital modeling and fabrication defining architecture and design as a Construction / Production process through the use of 3D modeling softwares. The aim is to achieve simple and complex geometries, 2D and 3D structures by adding and mixing different manufacturing methods.
 FabLab Beirut offers also research workshops and services that serve many fields, such as prosthetics in 3D printing, fabric patternization, laser cutting techniques and molds milling.
 
 workshops also teaches how to apply interactive applications in the inventions.
The Cad-Cam technology is here to allow designers to think of their designs as production, which is different from having a passive image on screen. It allows them to find technical solutions, test materials, assemble products and manufacture different scales.
 
 
 
 The lab also gathers communities and allows co-working events from workshops, lectures, projects application of people coming from different fields. Architects, designers, engineers,technologists, students and young makers are invited to invent and make impact on the surrounding society. The market will receive new products resulting from computational tools and their application in digital fabrication.",Fab Lab,Fab Lab,info@fablabbeirut.com,http://www.fablabbeirut.com,961736794,,33.8986234,35.4775211,"three_d_printing, cnc_milling, laser, precision_milling, vinyl_cutting,","Located in the heart of the city, FabLab Beirut is a maker space where an idea will turn into a reality! Digital architecture, prototyping, 3D printing, milling processes, laser cutting and much more!",https://www.fablabs.io/FablabBeirut,,,,,,,,,,,,,,,,,,,,,,,,,,,,,,,,,,,,,,,,,,,,,,,,,,,,,,,,,,,,,,
fab lab,Existing space,,Fab Lab Belem,Brazil,"Travessa Benjamin Constant, 1337,  66035-060, In the second floor.","Belem, ParÛ",,"It is a small lab, with a couple of machines and it's purpose is to develop a community around it devoted to digital fabrication and the noetic era. ",Fab Lab,Fab Lab ,thiagokunz@yahoo.com.br,https://www.facebook.com/groups/161326217395967/,'+55 91 9135-0189,,-1.45365,-48.488,"three_d_printing, circuit_production, precision_milling, ","It is a small lab, with a couple of machines and it's purpose is to develop a community around it devoted to digital fabrication and the noetic era.",https://www.fablabs.io/fablabbelem,,planned_fab_lab,,,,,,,,,,,,,,,,,,,,,"-1.45365,-48.488",,,,,,,,,,,,,,,,,,,,,,,,,,,,,,,,,,,,,,,
fab_lab,,Europe,Fab Lab Belgorod,Russia,"Œ_aÎ. a_aoŒÅŒ_Œ_a_aoa_aö, 46 a_aoŒ_a_Œ_ŒÅ 1,  308000, ","a_a_aÎa¥aoŒ_aoa_, Russia",, ,Fab Lab,fab lab,fablab@mail.ru,,74722420823,,50.58127575,36.59645421,"three_d_printing, cnc_milling, circuit_production, laser, precision_milling, vinyl_cutting",,https://www.fablabs.io/fablabbelgorod,,,,,,,,,,,,,,,,,,,,,,,,,,,,,,,,,,,,,,,,,,,,,,,,,,,,,,,,,,,,,,
fab_lab,,Europe,Fab Lab Belgrade,Serbia,"Bulevar kralja Aleksandra 73,  11000, Walking through the parking of the Faculty, you can easily find us on the rear side of the building. Our Fab Lab is available from both entrances. ","Beograd, ",,"Fab Lab Belgrade is the first open access research and digital fabrication start-up in the country. Dobrodoè_li to Fab Lab Belgrade!



We are a design and prototyping workshop/hub. You can find in our space access to the latest digital prototyping tools, the expertise and training you might need, and a group of like-minded and enthusiastic people who can share ideas, knowledge and experience.



Fab Lab Belgrade brings people from different fields into a vibrant network involving professionals, technology, design, engineering, coding and many others. 



One of our main goals is to reduce the capital cost issues for designers and makers, supporting startups to develop, grow and bring innovative services, products and ideas to the forefront of Serbian Industry.



We have a great team always ready to help you to build, make, test, and manufacture your ideas, work with your company or share the skills you need to develop your projects, all in an open and friendly hub!",Fab Lab,fab lab,fablabbelgrade@gmail.com,,3.82E+11,,44.80605641,20.4757711,"three_d_printing, cnc_milling, laser, vinyl_cutting,  ",Fab Lab Belgrade is the first open access research and digital fabrication start-up in the country.,https://www.fablabs.io/fablabbelgrade,,,,,,,,,,,,,,,,,,,,,,,,,,,,,,,,,,,,,,,,,,,,,,,,,,,,,,,,,,,,,,
fab_lab,,Europe,Fab Lab Berlin,Germany,"Saarbr—_cker Straae 24, Haus C 10405, Haus C - 1st floor, door on the left.



Opening hours: Monday ___ Friday between 10.00 and 20.00 and Saturday ___ Sunday between 12.00 and 18.00","Berlin, ",,"Full Fab Lab in the center of Berlin. Specialized on developing and building 3D Printers We are an open digital fabrication studio where you can learn how to use 3D printers, laser cutters, CNC Routers, design software and electronics to make (almost) anything you want. We are part of the international Fab Lab network and offer access to a professional DIY studio and a great community of makers.

We offer a safe working environment with professional state-of-the art tools and software. We have regular opening hours and a studio that is dedicated to hosting digital fabrication workshops and building prototypes. Our space is an interface between Berlin's makers, companies and educational institutions.",Fab Lab,fab lab,mail@fablab-berlin.org,http://www.meetup.com/FabLabBerlin/members/117574612/,+49 15 777 51 7776,"<http://www.3dhubs.com/berlin/hubs/fab-lab>, <https://twitter.com/FabLabBLN/>, <https://www.facebook.com/FabLabBerlin>, <http://www.fablab-berlin.org>, <>",52.53017555,13.41300271,"three_d_printing, cnc_milling, circuit_production, laser, precision_milling, vinyl_cutting",Full Fab Lab in the center of Berlin. Specialized on developing and building 3D Printers,https://www.fablabs.io/fablabberlin,,,,,,,,,,,,,,,,,,,,,,,,,,,,,,,,,,,,,,,,,,,,,,,,,,,,,,,,,,,,,,
fab lab,,,Fab Lab Bogota,Colombia,"Bogota, Cll 63 No. 3 09 , ","Bogota, Cundinamarca",," We are firm believers in the power of collective action and empowering communities and individuals to positively affect their environment, economy and society in general. This is why we are so passionate about FabLab, and enabling this concept in Bogota, Colombia. We are developing a different approach to learning, specially design education, where hands on skills and crafts are what we consider the best vehicles to promote and incentivize learning. Attuned to the global context, we believe being able to set up and operate a FabLab in Bogota, Colombia would be a great contribution to solving global issues, locally. We know that a multidisciplinary approach is not enough, we need to create interdisciplinary interactions, this is why FabLab is open to anyone that wishes to develop projects and contribute to ideas and concepts. It will be an open space, where people from any discipline, makers are welcome to participate hands on experiments and project development.",Fab Lab,Fab Lab ,nicolas@dosunodesign.com,,(57''+1) 2550355,,4.645451,-74.057,"three_d_printing, ",,https://www.fablabs.io/atomfablabbogot,,planned_fab_lab,,,,,,,,,,,,,,,,,,,,,"4.645451,-74.057",,,,,,,,,,,,,,,,,,,,,,,,,,,,,,,,,,,,,,,
fab_lab,,,Fab Lab Buenos Aires,Argentina,"Pacheco de Melo 2888,  1425, ","Buenos Aires, Autonomous City of Buenos Aires",,"El FAb Lab Buenos Aires es el primer Fab Lab de la Argentina El Fab Lab Buenos Aires es un proyecto de  laboratorio de fabricacion digital de acuerdo a los mÛs altos estandares de la Red  internacional Fab Lab; y es desarrollado en forma conjunta por El Reactor, y otros emprendimientos libres de fabricacion digital abierta de la rep£blica argentina. 

El objetivo de esta iniciativa es democratizar el acceso a la fabricacion digital y a las nuevas tecnologças de disei_o, proponiendo una modalidad de trabajo colaborativa y en red, ofreciendo un ambiente  favorable para la vinculacion y el desarrollo integral de capacidades tecnologicas, donde la creatividad y  el conocimiento dan origen a la innovacion.

El valor del proyecto reside en el solido vçnculo social que se quiere generar dando lugar a un Ûrea abierta, que apunta a vincular un amplio grupo de usuarios como ingenieros, investigadores, disei_adores  y estudiantes, empresas e instituciones educativas; quienes podrÛn hacer uso de este lugar para experimentar y desarrollar proyectos contando con la asistencia de profesionales expertos. 

Fab Lab Buenos Aires un proyecto de consolidacion de un laboratorio de fabricacion digital pequei_o, en el medio de la ciudad, para acceso de los vecinos del barrio donde nuestro estudio El Reactor esta asentado.

BasÛndonos en el modelo del Mini Fab Lab de Holanda, publicado en  http://www.minifablab.nl, estamos trabajando para instalar un  pequei_o centro de fabricacion digital que pueda ser reproducible en toda la region.

El proyecto explora la accesibilidad a maquinas de fabricacion digital de escritorio, para establecer laboratorios pequei_os en estudios de artistas, casas, colegios, makerspaces, hackerspaces, librerças y laboratorios moviles.

La mision consiste en  lograr establecer un paquete de iniciacion de un mini fab lab con mÛquinas de fabricacion abierta capaces de poder ser fabricadas en un fab lab nodo o laboratorio ciudadano substancial. Nuestro objetivo es suplantar el paquete de 80.000 USD que el MIT ofrece por uno de 100.000 pesos moneda local, donde se puedan adquirir las tecnologças bÛsicas de fabricacion digital.

Las mÛquinas de este paquete son las siguientes:

Impresoras 3d tipo Prusa i3

Scanner tipo Kinect

Router de media Placa 1.2 x 1.2mts

Cortadora lÛser pequei_a, ver proyecto LaOS

Cortadora de Vinilo



Soldadores, Arduino y estacion electronica de medicion

En la Conferencia FAB9 en Yokohama se le pidio a grupo de holanda que explore un Small Fablab Suite para el fab ab de 10.000 usd,  que se llaman pequei_os labs en el rango de 10 y 20 mil dolares.



Nuestro proyecto consiste en consolidar una red de laboratorios accesibles en la Argentina.",Fab Lab,Fab Lab ,"info@elreactor.com, cmdlab@buenosaires.gob.ar",http://www.elreactor.com,5411 4806 7082,"<https://twitter.com/FabLabBsAs>, <https://www.facebook.com/FabLabBuenosAires>, <>, <>, <>",-34.5861,-58.404,"three_d_printing, cnc_milling, circuit_production, laser, precision_milling, ",El FAb Lab Buenos Aires es el primer Fab Lab de la Argentina,https://www.fablabs.io/fablabbuenosaires,,,,,,,,,,,,,,,,,,,,,,,"-58.404,-34.5861",,,,,,,,,,,,,,,,,,,,,,,,,,,,,,,,,,,,,,,
"open,fab_lab",Academic,Europe,Fab Lab Cardiff,United Kingdom,"Western Avenue, Llandaff Campus CF5 2YB, ",Cardiff,, ,Fab Lab,fab lab,okotsifa@cardiffmet.ac.uk,http://fablabcardiff.com,,https://www.facebook.com/cardiffschoolofartanddesign,51.4964767,-3.2126153,,,,,,,,,,,,,2014,,,@csadnews,,,,,,,,,,,,,,,,,,,,Olivia,Kotsifa,Communication,http://movement.open.co/sites/default/files/styles/medium/public/fab-lab-cardiff.jpeg?itok=3XHC0kMK,"Making, Learning","Community, Tech",Physical,Local,,,,,Cardiff Metropolitan University,Western Ave,,Cardiff,CF5 2YB,"Cardiff Metropolitan University, Western Ave,  Cardiff, CF5 2YB","Part of the Fab Lab network, a global collection of small-scale workshops containing the tools for personal digital fabrication.",Makerspace,51.481581,-3.17909,,,,,,,,
fab_lab,,USA,Fab Lab Charlotte Latin,United States,"9502 Providence Rd, Science, Art and Technology Building 28277, The lab is in the Science, Art and Technology (SAT) Building.  Rooms 606a and 606b. ","Charlotte, ", ,"We are K12, college-prep school that works with the community at-large to encourage students to become technology creators, not just consumers. ",Fab Lab,Fab Lab,tdubick@charlottelatin.net,,704.846.7275,,35.0798,-80.7749,"three_d_printing, cnc_milling, circuit_production, laser, precision_milling, vinyl_cutting","We are K12, college-prep school that works with the community at-large to encourage students to become technology creators, not just consumers.",https://www.fablabs.io/fablabcharlottelatin,,,,,,,,,,,,,,,,,,,,,,"35.0798323, -80.7749055",,"9502 Providence Rd, Charlotte, NC 28277, United States","35.0795629, -80.7746013",https://maps.gstatic.com/mapfiles/place_api/icons/school-71.png,f07297bee272e02cc4f00a39b8a521679d1a567d,ChIJp7TG9agnVIgRVqkX70l_osI,Charlotte Latin School,,4.3,"[u'school', u'point_of_interest', u'establishment']",,,,,,,,,,,,,,,,,,,,,,,,,,,,,,
fab_lab,,Europe,FAB LAB Chateau Thierry,France,"7 avenue de l'Europe,  2400, Office : 7, avenue de l'Europe 02400 Chateau Thierry","Chateau-Thierry, Picardie",,"Come on Makers ! Our purpose is to show the young people how fun making is ; this country fab lab is also a place to meet industrials who search for new employees or students.



  Tuesday : 13.30 - 20.00

  Wednesday : 13.30 - 20.00

  Thursday : 13.30 -20.00

  Friday : 13.30 - 17.30 OPEN LAB 17.30 - 20.30

  Saturday : 10.00 - 12.00 ; 13.30 - 20.00





New machine ! plane grinder with magnetic table



September 2015 invests : Digital Sewing, new CNC Rooter, more computers, Form 1+  High-Resolution 3D Printer, ",Fab Lab,fab lab,fablabct02@gmail.com,https://www.facebook.com/fablab.chateau.thierry,,,49.0374892,3.3981522,"three_d_printing, cnc_milling, laser, precision_milling, vinyl_cutting, ",Come on Makers !,https://www.fablabs.io/fablabchateauthierry,,,,,,,,,,,,,,,,,,,,,,,,,,,,,,,,,,,,,,,,,,,,,,,,,,,,,,,,,,,,,,
Hacedores,,,Fab Lab Chihuahua ,Mexico,"Av. Heroico Colegio Militar 4700, Col Nombre de Dios, Chihuahua, CHIH 31150, Mexico","Av. Heroico Colegio Militar 4700, Col Nombre de Dios, Chihuahua, CHIH 31150, Mexico",,"Un FAB LAB (Fabrication Laboratory) facilita la produccion y lanzamiento de partes y productos propios en el Ûrea de manufactura para las empresas peque†as y medianas. Contiene las maquinas necesarias para producir prototipos en peque†a escala. El de Chihuahua en especifico esta dise†ado para el sector metalmecÛnico, como sector transversal que apoya a la industria automotriz, electronica, el_ctrica y aeroespacial.",Fab Lab,Fab Lab ,sergio.mancinas@fablabchihuahua.com,http://www.fablabchihuahua.com/,"(614)4240166, ",,28.691,-106.085,,,,,,,,,,,,,,,,,,,,,,,,,,"-106.085,28.691",,,,,,,,,,,,,,,,,,,,,,,,,,,,,,,,,,,,,,,
unverified fab lab,,,FAB LAB CONCEPCION,Chile,"Lincoyan 1370, Concepcion, Concepcion, Region del Bio Bio, Chile",,,,Fab Lab,Fab Lab ,podachile@gmail.com,,,,-36.819,-73.0593,,,,,,,,,,,,,,,,,,,,,,,,,,"-73.0593,-36.819",,,,,,,,,,,,,,,,,,,,,,,,,,,,,,,,,,,,,,,
Makery,,,Fab Lab Cote d'Opale,France,"885 rue Louis Breguet, Atelier 4, 62100 Calais",,,,Fab Lab,Fablab,,http://www.fablabcotedopale.com,,,50.9458,1.91436,,,,,,,,,,,,,,,,,https://www.facebook.com/groups/1575104049378936/,,,,,,,,,,,,,,,,,,,,,,,,,,,,,,,,,,,,,,,,,,,,,,,,
fab lab,Existing space,,Fab Lab Cuiaba,Brazil,"Avenida Fernando Correa da Costa, 2367, Boa Esperança 78060900, Universidade Federal de Mato Grosso - Departamento de Arquitetura e Urbanismo (Faculdade de Arquitetura, Engenharias e Tecnologia). ","CuiabÛ, MT",,"A Fab Lab located in Architecture and Urbanism department in Federal University of Mato Grosso (UFMT). As a Fab Lab located in Architecture and Urbanism department in Federal University of Mato Grosso (UFMT), our aim is to introduce in our city and state these new concepts in digital fabrication. ",Fab Lab,Fab Lab ,fablabcuiaba@gmail.com,http://www.fablabcba.com.br,5.57E+11,"<https://www.facebook.com/fablabcba>, <>, <>, <>, <>",-15.609,-56.065,"three_d_printing, cnc_milling, circuit_production, laser, precision_milling, vinyl_cutting",A Fab Lab located in Architecture and Urbanism department in Federal University of Mato Grosso (UFMT).,https://www.fablabs.io/fablabcuiaba,,mini_fab_lab,,,,,,,,,,,,,,,,,,,,"18_ 28' 44"", -69_ 53' 26""","-56.065,-15.609",,,,,,,,,,,,,,,,,,,,,,,,,,,,,,,,,,,,,,,
"open,fab_lab",Entrepreneur,North America,Fab Lab DC,United States,"Washington, District of Columbia, 20002, ",Washington,,,Fab Lab,,info@fablabdc.org,http://www.fablabdc.org,,https://www.facebook.com/pages/FAB-LAB-DC/320444572757,38.9092,-77.0095,,,,,,,,,,,,,2012,,,https://twitter.com/FabLabDC,,,,,,,,,,,,,,,,,,,,Phyllis,Klein,Manager,http://movement.open.co/sites/default/files/styles/medium/public/fab-lab-dc.jpeg?itok=sQQcWmyU,"Making, Learning","Community, Tech",Physical,Local,,,,,1418 North Capitol Street,,District of Columbia,Washington,20002,"1418 North Capitol Street,  District of Columbia, Washington, 20002","Part of the Fab Lab network, a global collection of small-scale workshops containing the tools for personal digital fabrication.",Makerspace,38.909206,-77.00946,,,,,,,,
Makery,,,Fab Lab du PEC,Canada,1691 Pie-IX Montreal,,,,Fab Lab,Fablab,,http://www.fablabpec.com,,,45.5496,-73.539,,,,,,,,,,,,,,,,,,,,,,,,,,,,,,,,,,,,,,,,,,,,,,,,,,,,,,,,,,,,,,,,,
Makery,,,FAB LAB E-Bus (itinerant),France,Concarneau Cornouaille Agglomeration 1 rue Victor Schoelcher CONCARNEAU,,,,Fab Lab,Fablab,,,,,47.9014,3.90537,,,,,,,,,,,,,,,,,http://www.facebook.com/ebuscca/?fref=ts,,,,,,,,,,,,,,,,,,,,,,,,,,,,,,,,,,,,,,,,,,,,,,,,
fab_lab,,,Fab Lab Ecuador,Ecuador,"Jos_ Tamayo N 21- 258, Jeronimo Carrion 170517, ","Quito, Pichincha",,"Fab Lab Ecuador is the first Red of digital fabrication laboratories in Ecuador founded in 2015 to revolutionize the concept of construction and design in Ecuador Fab Lab Ecuador is the first Red of digital fabrication laboratories in Ecuador founded in 2015 to revolutionize the concept of construction and design in Ecuador. Commune with theories FabLab is the democratic use of technology for social good, work areas such as product prototyping, architectural design, development of machinery open source development of technology for social use and development of country. We have the support FABLAT super node and FAB Foundation who is in charge in Latin America by Benito Juarez, and work is underway together to strengthen the bonds of FabLab in Ecuador. 3DLAB/FABLABUIO is located in Quito the capital of Ecuador and want from here to enrich the potential of FabLabs network in our country becoming a major hub for development.



we have the human personnel commensurate with the necessary machinery for unfolding as a complete FabLab.



within our staff we have architects, industrial designers, they ingenieron is electronics and robotics.



3dlab is aware that there may be a workshop in which technological innovation can give joints to change public policies and commune with changing production model in our country",Fab Lab,Fab Lab ,3dlabquito@gmail.com,https://www.facebook.com/fablabec,'+593 26025383,,-0.2078,-78.4915,"three_d_printing, cnc_milling, laser, precision_milling, vinyl_cutting, ",Fab Lab Ecuador is the first Red of digital fabrication laboratories in Ecuador founded in 2015 to revolutionize the concept of construction and design in Ecuador,https://www.fablabs.io/fablabecuador,,,,,,,,,,,,,,,,,,,,,,"25_ 32' 36"", -103_ 27' 26""","-0.2078,-78.4915",,,,,,,,,,,,,,,,,,,,,,,,,,,,,,,,,,,,,,,
Ananse,Civil Society Led,Africa,Fab Lab Egypt,Egypt,"10 Abdulrahman El-Rafei (infront of Shooting club gate #5) St., from Makkah St., Dokki, Mohandessin, Giza","Dokki, Giza",,,Fab Lab,"HackerSpaces, fab labs","fablabegypt@gmail.com, info@fablab-egypt.com",www.fablab-egypt.org,Tel: +20 100 5237282 /'Tel: +20 112 2874837 / (Tel: +20) 11-1160-7406,<https://www.facebook.com/fablab.egypt><https://www.fablabs.io/fablabegypt>,30.049109,31.200878,,,,,,,,,,,,,,,,,,,,,,,,,,,,,,,,,,,,,,,,,,,,,,,,,,,,,,,,,,,,,,,,,
fab_lab,,Europe,Fab Lab Ellesmere Port,United Kingdom,"53 Whitby Road,  CH65 8AB, ","Ellesmere Port, Cheshire",, ,Fab Lab,fab lab,fablabep@manufacturinginstitute.co.uk,https://www.facebook.com/FabLabEllesmerePort,+44 (0)151 3568018,"<https://twitter.com/FabLabEllesmere>, <http://www.fab-lab-ellesmereport.org/>, <>, <>, <>",53.2798455,-2.8993004,"three_d_printing, cnc_milling, circuit_production, laser, vinyl_cutting, ",,https://www.fablabs.io/fablabellesmereport,,,,,,,,,,,,,,,,,,,,,,,,,,,,,,,,,,,,,,,,,,,,,,,,,,,,,,,,,,,,,,
